{
  "artifact_type": "team_published_depth_chart_source_registry",
  "contract_version": "team_published_depth_chart_source_registry_v0",
  "season": 2026,
  "assertion_scope": "official_team_source_discovery_and_candidate_coverage",
  "generated_at": "2026-08-10T15:07:48Z",
  "teams": [
    {
      "team_id": "ARI",
      "team_abbr": "ARI",
      "team_name": "Arizona Cardinals",
      "official_team_home_url": "https://www.azcardinals.com/",
      "official_depth_chart_page_candidate": "https://www.azcardinals.com/team/depth-chart",
      "official_media_release_discovery_rule": "Dated azcardinals.com club news article or club-hosted media/game-release asset only.",
      "supported_source_formats": ["dated_club_article", "club_hosted_image"],
      "last_checked_at": "2026-08-10T15:01:55Z",
      "last_qualifying_effective_date": "2026-08-02",
      "latest_verified_snapshot_id": null,
      "latest_verified_snapshot_sha256": null,
      "monitor_status": "manual_probe_healthy",
      "coverage_state": "official_source_discovered",
      "coverage_reason": "Dated article and original JPEG were hash-probed twice; immutable repo mirroring is blocked pending source-side redistribution rights."
    },
    {
      "team_id": "ATL",
      "team_abbr": "ATL",
      "team_name": "Atlanta Falcons",
      "official_team_home_url": "https://www.atlantafalcons.com/",
      "official_depth_chart_page_candidate": "https://www.atlantafalcons.com/team/depth-chart",
      "official_media_release_discovery_rule": "Official Falcons team page or dated club media release only.",
      "supported_source_formats": ["not_yet_qualified"],
      "last_checked_at": null,
      "last_qualifying_effective_date": null,
      "latest_verified_snapshot_id": null,
      "latest_verified_snapshot_sha256": null,
      "monitor_status": "not_checked_in_bounded_pilot",
      "coverage_state": "monitoring_degraded",
      "coverage_reason": "No hash-pinned source probe was retained in this bounded pilot and no scheduler is authorized."
    },
    {
      "team_id": "BAL",
      "team_abbr": "BAL",
      "team_name": "Baltimore Ravens",
      "official_team_home_url": "https://www.baltimoreravens.com/",
      "official_depth_chart_page_candidate": "https://www.baltimoreravens.com/team/depth-chart",
      "official_media_release_discovery_rule": "Official Ravens team page or dated club media/game release only.",
      "supported_source_formats": ["not_yet_qualified"],
      "last_checked_at": null,
      "last_qualifying_effective_date": null,
      "latest_verified_snapshot_id": null,
      "latest_verified_snapshot_sha256": null,
      "monitor_status": "not_checked_in_bounded_pilot",
      "coverage_state": "monitoring_degraded",
      "coverage_reason": "No source probe or operational monitor is authorized under this pilot."
    },
    {
      "team_id": "BUF",
      "team_abbr": "BUF",
      "team_name": "Buffalo Bills",
      "official_team_home_url": "https://www.buffalobills.com/",
      "official_depth_chart_page_candidate": "https://www.buffalobills.com/team/depth-chart",
      "official_media_release_discovery_rule": "Official Bills team page or dated club media release only.",
      "supported_source_formats": ["club_html_table"],
      "last_checked_at": "2026-08-10T15:07:48Z",
      "last_qualifying_effective_date": null,
      "latest_verified_snapshot_id": null,
      "latest_verified_snapshot_sha256": null,
      "monitor_status": "manual_probe_healthy",
      "coverage_state": "not_yet_published",
      "coverage_reason": "The hash-pinned official page explicitly states that the 2026 depth chart will be announced later."
    },
    {
      "team_id": "CAR",
      "team_abbr": "CAR",
      "team_name": "Carolina Panthers",
      "official_team_home_url": "https://www.panthers.com/",
      "official_depth_chart_page_candidate": "https://www.panthers.com/team/depth-chart",
      "official_media_release_discovery_rule": "Official Panthers team page or dated club article only.",
      "supported_source_formats": ["club_html_table"],
      "last_checked_at": "2026-08-10T15:02:44Z",
      "last_qualifying_effective_date": null,
      "latest_verified_snapshot_id": null,
      "latest_verified_snapshot_sha256": null,
      "monitor_status": "manual_probe_healthy",
      "coverage_state": "official_source_discovered",
      "coverage_reason": "Official page exposes a 2026 table, but no effective/publication date and no rights-cleared immutable receipt exist."
    },
    {
      "team_id": "CHI",
      "team_abbr": "CHI",
      "team_name": "Chicago Bears",
      "official_team_home_url": "https://www.chicagobears.com/",
      "official_depth_chart_page_candidate": "https://www.chicagobears.com/team/depth-chart-mobile",
      "official_media_release_discovery_rule": "Official Bears team page or dated club media release only.",
      "supported_source_formats": ["not_yet_qualified"],
      "last_checked_at": null,
      "last_qualifying_effective_date": null,
      "latest_verified_snapshot_id": null,
      "latest_verified_snapshot_sha256": null,
      "monitor_status": "not_checked_in_bounded_pilot",
      "coverage_state": "monitoring_degraded",
      "coverage_reason": "No hash-pinned source probe was retained in this bounded pilot."
    },
    {
      "team_id": "CIN",
      "team_abbr": "CIN",
      "team_name": "Cincinnati Bengals",
      "official_team_home_url": "https://www.bengals.com/",
      "official_depth_chart_page_candidate": "https://www.bengals.com/team/depth-chart",
      "official_media_release_discovery_rule": "Official Bengals team page or dated club media/game release only.",
      "supported_source_formats": ["not_yet_qualified"],
      "last_checked_at": null,
      "last_qualifying_effective_date": null,
      "latest_verified_snapshot_id": null,
      "latest_verified_snapshot_sha256": null,
      "monitor_status": "not_checked_in_bounded_pilot",
      "coverage_state": "monitoring_degraded",
      "coverage_reason": "No hash-pinned source probe was retained in this bounded pilot."
    },
    {
      "team_id": "CLE",
      "team_abbr": "CLE",
      "team_name": "Cleveland Browns",
      "official_team_home_url": "https://www.clevelandbrowns.com/",
      "official_depth_chart_page_candidate": "https://www.clevelandbrowns.com/team/depth-chart",
      "official_media_release_discovery_rule": "Official Browns team page or dated club media/game release only.",
      "supported_source_formats": ["not_yet_qualified"],
      "last_checked_at": null,
      "last_qualifying_effective_date": null,
      "latest_verified_snapshot_id": null,
      "latest_verified_snapshot_sha256": null,
      "monitor_status": "not_checked_in_bounded_pilot",
      "coverage_state": "monitoring_degraded",
      "coverage_reason": "No source probe or operational monitor is authorized under this pilot."
    },
    {
      "team_id": "DAL",
      "team_abbr": "DAL",
      "team_name": "Dallas Cowboys",
      "official_team_home_url": "https://www.dallascowboys.com/",
      "official_depth_chart_page_candidate": "https://www.dallascowboys.com/team/depth-chart",
      "official_media_release_discovery_rule": "Official Cowboys team page or dated club media/game release only.",
      "supported_source_formats": ["not_yet_qualified"],
      "last_checked_at": null,
      "last_qualifying_effective_date": null,
      "latest_verified_snapshot_id": null,
      "latest_verified_snapshot_sha256": null,
      "monitor_status": "not_checked_in_bounded_pilot",
      "coverage_state": "monitoring_degraded",
      "coverage_reason": "No source probe or operational monitor is authorized under this pilot."
    },
    {
      "team_id": "DEN",
      "team_abbr": "DEN",
      "team_name": "Denver Broncos",
      "official_team_home_url": "https://www.denverbroncos.com/",
      "official_depth_chart_page_candidate": "https://www.denverbroncos.com/team/depth-chart",
      "official_media_release_discovery_rule": "Official Broncos team page or dated club media/game release only.",
      "supported_source_formats": ["not_yet_qualified"],
      "last_checked_at": null,
      "last_qualifying_effective_date": null,
      "latest_verified_snapshot_id": null,
      "latest_verified_snapshot_sha256": null,
      "monitor_status": "not_checked_in_bounded_pilot",
      "coverage_state": "monitoring_degraded",
      "coverage_reason": "Candidate route is unverified and no operational monitor is authorized."
    },
    {
      "team_id": "DET",
      "team_abbr": "DET",
      "team_name": "Detroit Lions",
      "official_team_home_url": "https://www.detroitlions.com/",
      "official_depth_chart_page_candidate": "https://www.detroitlions.com/team/depth-chart",
      "official_media_release_discovery_rule": "Official Lions team page or dated club media/game release only.",
      "supported_source_formats": ["not_yet_qualified"],
      "last_checked_at": null,
      "last_qualifying_effective_date": null,
      "latest_verified_snapshot_id": null,
      "latest_verified_snapshot_sha256": null,
      "monitor_status": "not_checked_in_bounded_pilot",
      "coverage_state": "monitoring_degraded",
      "coverage_reason": "Candidate route is unverified and no operational monitor is authorized."
    },
    {
      "team_id": "GB",
      "team_abbr": "GB",
      "team_name": "Green Bay Packers",
      "official_team_home_url": "https://www.packers.com/",
      "official_depth_chart_page_candidate": "https://www.packers.com/team/depth-chart",
      "official_media_release_discovery_rule": "Official Packers team page or dated club media/game release only.",
      "supported_source_formats": ["not_yet_qualified"],
      "last_checked_at": null,
      "last_qualifying_effective_date": null,
      "latest_verified_snapshot_id": null,
      "latest_verified_snapshot_sha256": null,
      "monitor_status": "not_checked_in_bounded_pilot",
      "coverage_state": "monitoring_degraded",